המיזם הטכנולוגי גייס הון סיכון אדיר לפיתוח פלטפורמה אינטראקטיבית מבוססת אלגוריתמים.	hamezˈam hateχnolˈoɡi ɡijˈes hˈon sikˈun ʔadˈiʁ lefitˈuaχ platfˈoʁma ʔinteʁʔaktˈivit mevusˈeset ʔalɡoʁitmˈim.
המהנדסים תכננו גשר תלוי עם כבלי פלדה שיעמוד ברעידות אדמה חזקות.	hamhandsˈim tiχnnˈu ɡˈeʃeʁ talˈuj ʔˈim kavlˈej pladˈa ʃejaʔamˈod biʁeʔidˈot ʔadamˈa χazakˈot.
התיירים סיירו בטירה הסקוטית ושמעו אגדות אורבניות על רוחות רפאים עתיקות.	hatajaʁˈim sijʁˈu batiʁˈa haskˈotit veʃamʔˈu ʔaɡadˈot ʔuʁbanijˈot ʔˈal ʁuχˈot ʁefaʔˈim ʔatikˈot.
הכוריאוגרף שילב אלמנטים של בלט קלאסי, היפ-הופ וריקוד מודרני במופע.	hakoʁeʔoɡʁˈaf ʃilˈev ʔelementˈim ʃˈel balˈet klasˈi, hˈip hˈop veʁikˈud modˈeʁni bamofˈa.
איסוף בולים דורש סבלנות, פינצטה עדינה וזכוכית מגדלת לבחינת הפרטים.	ʔisˈuf bˈulim doʁˈeʃ savlanˈut, fintstˈa ʔadinˈa uzeχuχˈit meɡadˈelet livχinˈat hapʁatˈim.
מטבעות קריפטוגרפיים מבוזרים מאובטחים באמצעות בלוקצ'יין וחוזים חכמים נגד מתקפות סייבר.	matbʔˈot kʁiptoɡʁafijˈim mevuzaʁˈim meʔuvtaχˈim beʔemtsaʔˈut blˈuktʃijn veχozˈim χaχamˈim nˈeɡed mitkfˈot sajbˈeʁ.
דיונונים ענקיים משתמשים בהסוואה אופטית ובזרועות שריריות כדי לצוד במעמקי האוקיינוס.	djˈononim ʔanakijˈim miʃtamʃˈim behasvaʔˈa ʔˈoptit uvizʁoʔˈot ʃʁiʁijˈot kedˈej latsˈud bemaʔamakˈej haʔˈokjanos.
האפידמיולוגים עקבו אחר התפשטות הנגיף המוטנטי באמצעות בדיקות סרולוגיות וריצוף גנטי.	haʔepidˈemjˈolˈoɡim ʔakvˈu ʔaχˈaʁ hitpaʃtˈut hanɡˈif hamotˈenti beʔemtsaʔˈut bdikˈot seʁoloɡijˈot veʁitsˈuf ɡenˈeti.
מסוקי האפאצ'י המתקדמים ביצעו תמרונים אווירובטיים מסובכים מעל בסיס חיל האוויר בדרום.	mesokˈej haʔapatʃˈi hamitkadmˈim bitsʔˈu timʁunˈim ʔaviʁobˈatijim mesubaχˈim meʔˈal bsˈis χˈel haʔavˈiʁ badaʁˈom.
אימפריית האינקה ניהלה רשת דרכים מסועפת בהרי האנדים למרות היעדר גלגלים.	ʔimpˈeʁjat haʔinkˈa nihalˈa ʁˈeʃet dʁaχˈim mesoʔˈefet behaʁˈej haʔandˈim lamʁˈot heʔadˈeʁ ɡalɡalˈim.
תיבת ההילוכים האוטומטית הרציפה משפרת את ההאצה ומקטינה את צריכת הדלק.	tevˈat hahiluχˈim haʔotomˈatit haʁtsifˈa meʃapˈeʁet ʔˈet haheʔatsˈa umaktinˈa ʔˈet tsʁiχˈat hadˈelek.
הלטאה מסוגלת להניע כל עין בנפרד ולשגר לשון דביקה במהירות.	halitaʔˈa mesuɡˈelet lehanˈia kˈol ʔˈajin benifʁˈad ulʃaɡˈeʁ laʃˈon dvikˈa bimehiʁˈut.
חלקיקים חסרי מסה כמעט חולפים דרך כדור הארץ ללא שום אינטראקציה.	χelkikˈim χasʁˈej masˈa kimʔˈat χolfˈim dˈeʁeχ kadˈuʁ haʔaʁˈets lelˈo ʃˈum ʔinteʁʔˈaktsˈija.
סרטי אנימציה ממוחשבים דורשים חוות שרתים עצומות לרינדור גרפי של טקסטורות מורכבות.	siʁtˈej ʔanimˈatsja memuχʃavˈim doʁʃˈim χavˈat ʃaʁatˈim ʔatsumˈot leʁindˈuʁ ɡʁafˈi ʃˈel tˈekstˈuʁot muʁkavˈot.
צמחים טורפים נסגרים ברגע שחרק נוגע בשערות החישה הזעירות.	tsmaχˈim toʁfˈim nisɡaʁˈim baʁˈeɡa ʃeχeʁˈak noɡˈea bisʔaʁˈot haχiʃˈa hazeʔiʁˈot.
קניונים גיאולוגיים עמוקים נוצרים לאורך מיליוני שנים עקב שחיקה של זרמי נהרות.	kanjonˈim ɡeʔolˈoɡijim ʔamukˈim notsaʁˈim leʔoʁˈeχ miljˈonej ʃanˈim ʔˈekev ʃχikˈa ʃˈel ziʁmˈej nehaʁˈot.
כרומטוגרפיה נוזלית יעילה משמשת להפרדת תרכובות אורגניות בתעשיית התרופות והקוסמטיקה המודרנית.	kʁˈomˈatoɡʁˈafja nozlˈit jeʔilˈa meʃamˈeʃet lehafʁadˈat taʁkovˈot ʔoʁɡˈanijot betaʔasijˈat hatʁufˈot vehakosmetˈika hamodˈeʁnit.
הדרקון המיתולוגי ירק אש קטלנית ומרחף מעל טירת האבירים העתיקה באירופה.	hadʁakˈon hamitolˈoɡi jaʁˈak ʔˈeʃ katlanˈit umʁaχˈef meʔˈal tiʁˈat haʔabiʁˈim haʔatikˈa beʔejʁopˈa.
ממשק המשתמש האינטראקטיבי באפליקציה תוכנן בקפידה כדי להעניק חווית ניווט אינטואיטיבית וחלקה.	mimʃˈak hamiʃtamˈeʃ haʔinteʁʔaktˈivi baʔaplˈikˈatsja tuχnˈan bikfidˈa kedˈej lehaʔanˈik χavajˈat nijvˈut ʔintuʔitivˈit vaχalakˈa.
השחקנים החסונים התנגשו בעוצמה במהלך משחק הגמר הדרמטי באצטדיון הלאומי הומה האדם.	hasaχkanˈim haχasunˈim hitnaɡʃˈu beʔotsmˈa bemahalˈaχ misχˈak haɡmˈaʁ hadʁamˈati baʔitstadjˈon haleʔumˈi homˈe haʔadˈam.
פיסול ברונזה קלאסי דורש יציקת מתכת מותכת לתבניות שעווה נמסות בטמפרטורות גבוהות.	pisˈul bʁˈonˈza klasˈi doʁˈeʃ jetsikˈat matˈeχet mutˈeχet letavnijˈot ʃaʔavˈa nimesˈot betempeʁatˈuʁot ɡvohˈot.
הקרטל הבינלאומי של יצרניות הנפט מניפולטיבי ומשפיע משמעותית על תנודות המחירים בשוק.	hakaʁtˈel habenleʔumˈi ʃˈel jatsʁanijˈot hanˈeft manipulatˈivi umaʃpˈia maʃmaʔutˈit ʔˈal tnudˈot hamχiʁˈim baʃˈuk.
כלבי תחש גזעיים נוטים לסבול מבעיות אורתופדיות בעמוד השדרה עקב מבנה גופם הארוך.	kalvˈej tˈaχaʃ ɡizʔijˈim notˈim lisbˈol mibeʔajˈot ʔoʁtopedijˈot beʔamˈud haʃidʁˈa ʔˈekev mivnˈe ɡufˈam haʔaʁˈoχ.
טיפול קוגניטיבי התנהגותי מסייע למטופלים לזהות ולשנות דפוסי חשיבה דפרסיביים וחרדתיים.	tipˈul koɡnitˈivi hitnahaɡutˈi mesajˈea lamtupalˈim lezahˈot ulʃanˈot dfusˈej χaʃivˈa dapeʁasˈivijim vaχaʁdatijˈim.
הקונגרס האמריקאי אישר תקציב פדרלי אסטרונומי לשיקום תשתיות ופיתוח פרויקטים סביבתיים ירוקים.	hakonɡʁˈes haʔameʁikaʔˈi ʔiʃˈeʁ taktsˈiv fedeʁˈali ʔastʁonˈomi leʃikˈum taʃtijˈot ufitˈuaχ pʁojˈektim svivatijˈim jeʁukˈim.
מעצבת האופנה שילבה בדים סינתטיים ממוחזרים בקולקציית האביב שהוצגה בפריז.	meʔatsˈevet haʔofnˈa ʃilvˈa badˈim sintˈetijim memuχzaʁˈim bekolektsijˈat haʔavˈiv ʃehutsɡˈa befaʁˈiz.
סופות רעמים טרופיות מלוות בברקים מסנוורים, מטחי ברד כבדים ומשבי רוח עזים במיוחד.	sufˈot ʁeʔamˈim tʁofijˈot meluvˈot bivʁakˈim mesanvʁˈim, matχˈej baʁˈad kvedˈim umaʃbˈej ʁˈuaχ ʔazˈim bimjuχˈad.
אמן האשליות ביצע טריק טלפתיה מדהים שהשאיר את הקהל הסקפטי המום לחלוטין.	ʔomˈan haʔaʃlajˈot bitsˈea teʁˈik talˈepetja madhˈim ʃehiʃʔˈiʁ ʔˈet hakahˈal haskˈpti hamˈum laχalutˈin.
הטרנזיסטורים הזעירים במעבד המחשב פועלים כמתגים אלקטרוניים זעירים המעבדים מידע בינארי.	hatʁanzˈistoʁim hazʔiʁˈim bimʔabˈed hamaχʃˈev poʔalˈim kmataɡˈim ʔelektʁˈonijim zeʔiʁˈim hameʔabdˈim medˈa binaʁˈi.
דבורי הדבש האפריקאיות אגרסיביות יותר בהגנה על הכוורת מאשר זנים אירופאים מתורבתים.	dvoʁˈej hadvˈaʃ haʔafʁikaʔijˈot ʔaɡʁesˈivijot jotˈeʁ bahaɡanˈa ʔˈal hakaveʁˈet meʔaʃˈeʁ zanˈim ʔejʁopeʔˈim metuʁbatˈim.
קליית פולי הקפה האתיופיים מדגישה טעמים פירותיים ופרופיל ארומטי בעל חמיצות מעודנת.	klijˈat pˈolej hakafˈe haʔˈetjopijim madɡiʃˈa teʔamˈim peʁotijˈim ufʁofˈil ʔaʁˈomˈati bˈaʔal χamitsˈut meʔudˈenet.
פמיניזם רדיקלי קורא לשינוי יסודי במבנים של החברה והתרבות המערבית המודרנית.	feminˈizm ʁadikˈali koʁˈe leʃinˈuj jesodˈi bamivnˈim ʃˈel haχevʁˈa vehataʁbˈut hamaʔaʁavˈit hamodˈeʁnit.
הטורבינות הענקיות בסכר ממירות את האנרגיה הקינטית של המים לחשמל זמין.	hatuʁbinˈot haʔanakijˈot basˈeχeʁ memiʁˈot ʔˈet haʔenˈeʁɡija hakinˈetit ʃˈel hamˈajim leχaʃmˈal zamˈin.
פלאש המצלמה מאפשר הקפאת תנועה של אובייקטים מהירים בחושך כמעט מוחלט.	plˈaʃ hamatslemˈa meʔafʃˈeʁ hakpaʔˈat tnuʔˈa ʃˈel ʔobjektˈim mehiʁˈim baχˈoʃeχ kimʔˈat muχlˈat.
הוא כתב סאטירה פוליטית נושכת המבקרת את הביורוקרטיה הממשלתית דרך מצבים אבסורדיים.	hˈu katˈav satiʁˈa polˈitit noʃˈeχet hamvakˈeʁet ʔˈet habijuʁokʁˈatja hamemʃaltˈit dˈeʁeχ matsavˈim ʔabsˈuʁdijim.
בלשי המשטרה השתמשו בזיהוי פלילי וטביעות אצבע כדי ללכוד את השודד הסדרתי.	balaʃˈej hamiʃtaʁˈa hiʃtamʃˈu bezihˈuj plilˈi utviʔˈot ʔetsbˈa kedˈej lilkˈod ʔˈet haʃodˈed hasidʁatˈi.
פרקטלים גיאומטריים מציגים דמיון עצמי בכל קנה מידה ונמצאים רבות בטבע סביבנו.	pʁˈektˈalim ɡeʔomˈetʁijim matsiɡˈim dimjˈon ʔatsmˈi beχˈol knˈe midˈa venimtsaʔˈim ʁabˈot batˈeva svivˈenu.
אנטיאוקסידנטים הנמצאים בפירות יער מנטרלים רדיקלים חופשיים ומאטים את תהליך ההזדקנות התאית.	ʔˈantiʔoksˈidˈentim hanimtsaʔˈim befeʁˈot jˈaʔaʁ menatʁlˈim ʁadikˈalim χofʃijˈim umʔatˈim ʔˈet tahalˈiχ hahizdaknˈut hataʔˈit.
נזירים בודהיסטים יושבים שעות ארוכות במקדשים מבודדים בהרי ההימלאיה כדי להגיע להארה.	neziʁˈim budhistˈim joʃvˈim ʃaʔˈot ʔaʁukˈot bemikdaʃˈim mevudadˈim behaʁˈej hahimlajˈa kedˈej lehaɡˈia leheʔaʁˈa.
הטרקטורון הכבד פינה פסולת בניין גושית מאתר החפירות הארכיאולוגי כדי למנוע נזק.	hatʁˈaktoʁon hakavˈed pinˈa psˈolet binjˈan ɡuʃˈit meʔatˈaʁ haχafiʁˈot haʔaʁχeʔolˈoɡi kedˈej limnˈoa nˈezek.
רופא השיניים התקין שתלי טיטניום והמליץ על שטיפות פלואוריד למניעת עששת חמורה.	ʁofˈe haʃinajˈim hitkˈin ʃtlˈej titanjˈum vehimlˈits ʔˈal ʃtifˈot ploʔoʁˈid limeniʔˈat ʔaʃˈeʃet χamuʁˈa.
רכבות קליע מגנטיות מרחפות מעל המסילה ומגיעות למהירויות פסיכיות ללא חיכוך מכני.	ʁakavˈot kalˈia maɡnˈetijot meʁaχefˈot meʔˈal hamsilˈa umaɡiʔˈot limhiʁujˈot psiχijˈot lelˈo χikˈuχ meχˈani.
קוביות הלגו הפלסטיות מאפשרות הרכבת מודלים תלת מימדיים מורכבים במגוון צבעים זרחניים.	kubijˈot haleɡˈo haplˈastijot meʔafʃʁˈot haʁkavˈat mˈodelim telˈat mimadijˈim muʁkavˈim bemiɡvˈan tsvaʔˈim zaʁχanijˈim.
מערכת הניווט הלוויינית חישבה מסלול אלטרנטיבי עקב פקק תנועה אינסופי בכביש המהיר.	maʔaʁˈeχet hanijvˈut halavjanˈit χiʃvˈa maslˈul ʔalteʁnatˈivi ʔˈekev pkˈek tnuʔˈa ʔejnsofˈi bakvˈiʃ hamahˈiʁ.
שלד הדינוזאור שהתגלה במדבר שייך לטורף דו רגלי מתקופת הקרטיקון.	ʃelˈed hadinozˈaʔoʁ ʃehitɡalˈa bamidbˈaʁ ʃajˈaχ letˈoʁef dˈu ʁaɡlˈi mitkufˈat hakaʁtˈikˈon.
חובבי אוריגמי מקפלים ניירות מרובעים ליצירת דמויות זעירות ומורכבות ללא שימוש במספריים.	χovvˈej ʔoʁiɡˈemi mekaplˈim nejaʁˈot meʁubaʔˈim litsiʁˈat dmujˈot zeʔiʁˈot umuʁkavˈot lelˈo ʃimˈuʃ bemispaʁˈajim.
פיתוח מודלים מבוססי טקסט מצריך חומרה גרפית עוצמתית עם זיכרון רחב.	pitˈuaχ mˈodelim mevussˈej tˈekst matsʁˈiχ χumʁˈa ɡeʁafˈit ʔotsmatˈit ʔˈim zikaʁˈon ʁaχˈav.
מערכות זיהוי דיבור מתקשות לעיתים בפענוח חיתוך הפקה של עיצורים סדקיים וגרוניים.	maʔaʁχˈot zihˈuj dibˈuʁ mitkaʃˈot leʔitˈim befiʔnˈuaχ χitˈuχ hafakˈa ʃˈel ʔitsuʁˈim sdkijˈim uɡʁonijˈim.
חללית המחקר שוגרה בהצלחה כדי לאסוף דגימות קרקע מאסטרואיד קרוב לכדור הארץ.	χalalˈit hameχkˈaʁ ʃuɡʁˈa behatslaχˈa kedˈej leʔesˈof dɡimˈot kaʁkˈa meʔasteʁˈoʔid kaʁˈov leχadˈuʁ haʔˈaʁets.
הרנסנס האיטלקי התאפיין בפריחה חסרת תקדים של אמנות פלסטית, אדריכלות והגות הומניסטית.	haʁenesˈens haʔitalkˈi hitʔafjˈen bifʁiχˈa χasʁˈat takdˈim ʃˈel ʔomanˈut plˈastit, ʔadʁˈiχalut vehaɡˈut humanistˈit.
הרופא המומחה רשם אנטיביוטיקה רחבת טווח לטיפול בזיהום החיידקי החריף במערכת הנשימה.	haʁofˈe hamumχˈe ʁaʃˈam ʔˈantibijotika ʁaχavˈat tevˈaχ letipˈul bazihˈum haχajdakˈi heχaʁˈif bemaʔaʁˈeχet hanʃimˈa.
שף המסעדה מכין ריזוטו פטריות כמהין מוקרם עם פרמז'ן, יין לבן ועירית.	ʃˈaf hamisʔadˈa meχˈin ʁizotˈo pitʁijˈot kimhˈin mukʁˈam ʔˈim fʁemʒˈan, jˈajin lavˈan veʔiʁˈit.
גולשי הגלים המקצוענים התמודדו עם כל ענק וזרמים חזקים בחוף המפורסם בהוואי.	ɡolʃˈej haɡalˈim hamiktsoʔanˈim hitmodedˈu ʔˈim kˈol ʔanˈak uzʁamˈim χazakˈim baχˈof hamfuʁsˈam behavˈuj.
מפתחי התוכנה בנו תשתית אסינכרונית מהירה ויעילה לעיבוד מקבילי של נתוני משתמשים.	mefatχˈej hatoχnˈa banˈu taʃtˈit ʔasinχʁonˈit mehiʁˈa viʔˈila leʔibˈud makbilˈi ʃˈel netunˈej miʃtamʃˈim.
מדבר בצ'ילה נחשב לאזור היבש ביותר בעולם ומספק תנאים אידיאליים לתצפיות.	midbˈaʁ betʃilˈa nˈeχeʃav laʔezˈoʁ hajavˈeʃ bejotˈeʁ baʔolˈam umsapˈek tnaʔˈim ʔideʔˈalijim letatspijˈot.
הדיפלומטים חתמו על אמנה בינלאומית מקיפה לצמצום מאגר הנשק הגרעיני והביולוגי בעולם.	hadiplomˈatim χatmˈu ʔˈal ʔamanˈa benleʔumˈit makifˈa letsimtsˈum maʔaɡˈaʁ hanˈeʃek haɡaʁʔinˈi vehabijolˈoɡi baʔolˈam.
פלמינגו מצוי מקבל את צבעו הוורוד והבולט מתזונה עשירה בסרטנים זעירים ואצות.	plminɡˈo matsˈuj mekabˈel ʔˈet tsivʔˈo havaʁˈod vehabolˈet mitzunˈa ʔaʃiʁˈa besaʁtanˈim zeʔiʁˈim veʔatsˈot.
אדריכלות מאופיינת בקשתות מחודדות, תמיכות דואות וחלונות ויטראז' צבעוניים וענקיים.	ʔadʁˈiχalut meʔufjˈenet bkˈʃatot meχudadˈot, tmiχˈot doʔˈot vaχalonˈot vitʁˈaʒ tsivʔonijˈim vaʔanakijˈim.
עצי הסקויה הענקיים בקליפורניה יכולים לחיות אלפי שנים ולהגיע לגבהים בלתי נתפסים.	ʔatsˈej haskˈoja haʔanakijˈim bekalifoʁnijˈa jeχolˈim liχjˈot ʔalfˈej ʃanˈim ulehaɡˈia liɡvahˈim biltˈi nitpasˈim.
חומצה גופרתית היא נוזל קורוזיבי וחריף המשמש בתהליכים תעשייתיים רבים וייצור דשנים.	χumtsˈa ɡofaʁatˈit hˈi nˈozel koʁˈozivi veχaʁˈif hamʃamˈeʃ betahaliχˈim taʔasijatijˈim ʁabˈim vejitsˈuʁ dʃanˈim.
תיאוריית הפסיכואנליזה מתמקדת בהשפעת התת־מודע וחוויות הילדות המוקדמות על התנהגות האדם הבוגר.	teʔˈoʁjat hapsiχoʔanalˈiza mitmakˈedet behaʃpaʔˈat hatitmodˈea vaχavajˈot hajaldˈut hamukdamˈot ʔˈal hitnahaɡˈut haʔadˈam haboɡˈeʁ.
שופט בית המשפט העליון פרסם פסק דין תקדימי בנושא זכויות יוצרים דיגיטליות.	ʃofˈet bˈet hamiʃpˈat haʔeljˈon piʁsˈem psˈak dˈin takdimˈi benosˈe zeχujˈot jotsʁˈim diɡitˈalijot.
הבנק המרכזי העלה את הריבית במשק בניסיון לבלום את האינפלציה הגואה לאחרונה.	habˈank hameʁkazˈi heʔelˈa ʔˈet haʁibˈit bamˈeʃek benisajˈon livlˈom ʔˈet haʔinflˈatsja haɡoʔˈa laʔaχaʁonˈa.
רשת הרכבות התחתיות בלונדון היא אחת ממערכות התחבורה הציבורית הוותיקות והעמוסות בעולם.	ʁˈeʃet haʁakavˈot hataχtijˈot belondˈon hˈi ʔaχˈat mimaʔaʁχˈot hataχbuʁˈa hatsibuʁˈit havatikˈot vehaʔamusˈot baʔolˈam.
טרקטורים חקלאיים אוטונומיים מצוידים בחיישני ג'י־פי־אס מתקדמים לניווט מדויק בשדות הכותנה הרחבים.	tʁˈaktoʁim χaklaʔijˈim ʔotonˈomijim metsujadˈim beχajʃanˈej dʒifjˈas mitkadmˈim lenijvˈut medujˈak bisdˈot hakutnˈa haʁχavˈim.
הרומן הדיסטופי מתאר חברה טוטליטרית שבה השלטון מפקח על כל צעד אזרחי.	haʁˈoman hadistˈofi metaʔˈeʁ χevʁˈa totalitˈaʁit ʃebˈa haʃiltˈon mefakˈeaχ ʔˈal kˈol tsˈaʔad ʔezʁaχˈi.
מאיץ החלקיקים מאפשר לפיזיקאים לחקור את אבני הבניין היסודיות ביותר של החומר.	meʔˈits haχelkikˈim meʔafʃˈeʁ lafizikˈaʔim laχakˈoʁ ʔˈet ʔavnˈej habinjˈan hajsodijˈot bejotˈeʁ ʃˈel haχˈomeʁ.
מעצבי אופנה מובילים הציגו קולקציית חורף אלגנטית הכוללת מעילי צמר וצעיפי משי.	meʔatsvˈej ʔofnˈa movilˈim hitsˈiɡu kolektsijˈat χˈoʁef ʔeleɡˈantit hakolˈelet meʔilˈej tsˈemeʁ utseʔifˈej mˈeʃi.
פסקול הסרט ההוליוודי הוקלט על ידי תזמורת פילהרמונית וזכה בפרסים בינלאומיים יוקרתיים.	paskˈol hasˈeʁet haholiudˈi huklˈat ʔˈal jedˈej tizmˈoʁet filhaʁmˈonit vezaχˈa bifʁasˈim benleʔumijˈim jukʁatijˈim.
הגירה המונית מהכפר לעיר משנה את המרקם החברתי ויוצרת אתגרים אורבניים מורכבים.	haɡiʁˈa hamonˈit mehakfˈaʁ laʔˈiʁ meʃanˈa ʔˈet hamiʁkˈam haχevʁatˈi vejotsˈeʁet ʔetɡaʁˈim ʔuʁbˈanijim muʁkavˈim.
מערכת העצבים המרכזית כוללת את המוח וחוט השדרה ומעבדת אותות חושיים מהגוף.	maʔaʁˈeχet haʔatsabˈim hameʁkazˈit kolˈelet ʔˈet hamˈoaχ veχˈut haʃidʁˈa umʔabˈedet ʔotˈot χuʃijˈim mehaɡˈuf.
מהנדסי אלקטרוניקה מפתחים מעגלים מודפסים זעירים עבור סמארטפונים, מחשבים ניידים ומכשור רפואי.	mehandsˈej ʔelˈektʁˈonika mefatχˈim maʔɡalˈim mudpasˈim zeʔiʁˈim ʔavˈuʁ semaʁtfonˈim, maχʃvˈim najadˈim umiχʃˈoʁ ʁefuʔˈi.
טקטוניקת הלוחות מסבירה את נדידת היבשות, היווצרות רכסי הרים והתרחשות רעידות אדמה.	tˈaktonikat halˈuχot masbiʁˈa ʔˈet nedidˈat hajabaʃˈot, hijvatsʁˈut ʁiχsˈej haʁˈim vehitʁaχaʃˈut ʁeʔidˈot ʔadamˈa.
שחקני קונסולות תחרותיים מתאמנים שעות רבות ביום כדי לשפר את זמן התגובה.	saχkanˈej konsˈulot taχaʁutijˈim mitʔamnˈim ʃaʔˈot ʁabˈot bejˈom kedˈej leʃapˈeʁ ʔˈet zmˈan hatɡuvˈa.
פאנלים סולאריים על גגות הבתים מנצלים את קרינת השמש לייצור חשמל נקי.	panelˈim solaʁijˈim ʔˈal ɡaɡˈot habatˈim menatslˈim ʔˈet kʁinˈat haʃˈemeʃ lejitsˈuʁ χaʃmˈal nakˈi.
חפירות ארכיאולוגיות בעיר דוד חשפו ממצאים נדירים מתקופת בית המקדש הראשון.	χafiʁˈot ʔaʁχeʔolˈoɡijot baʔˈiʁ davˈid χasfˈu mimtsaʔˈim nediʁˈim mitkufˈat bˈet hamikdˈaʃ haʁiʃˈon.
כריתת יערות הגשם באמזונס מאיימת על המגוון הביולוגי ותורמת משמעותית להתחממות הגלובלית.	kʁitˈat jaʔaʁˈot haɡˈeʃem beʔamzˈons meʔajˈemet ʔˈal hamiɡvˈan habijolˈoɡi vetoʁˈemet maʃmaʔutˈit lahitχammˈut haɡlobˈalit.
עדשות מאקרו מאפשרות לצלמים ללכוד פרטים זעירים של חרקים, פרחים וטקסטורות עדינות.	ʔadʃˈot makʁˈo meʔafʃʁˈot latsalamˈim lilkˈod pʁatˈim zeʔiʁˈim ʃˈel χaʁakˈim, pʁaχˈim vetekstˈuʁot ʔadinˈot.
תרגום סימולטני בכנסים בינלאומיים דורש ריכוז עילאי, שליטה בשפות והיכרות עם מונחים.	taʁɡˈum simultˈani biχnasˈim benleʔumijˈim doʁˈeʃ ʁikˈuz ʔilaʔˈi, ʃlitˈa baesafˈot vehekeʁˈut ʔˈim munaχˈim.
אורתודנטים משתמשים בגשרים שקופים ממתכת כדי ליישר שיניים ולתקן ליקויי סגר.	ʔoʁtodˈentim miʃtamʃˈim biɡʃaʁˈim ʃkufˈim mimatˈeχet kedˈej lejaʃˈeʁ ʃinajˈim uletakˈen likujˈej sˈeɡeʁ.
מטוס הנוסעים החדיש מצויד במנועי סילון שקטים וחסכוניים המפחיתים את זיהום האוויר.	metˈos hanosʔˈim haχadˈiʃ metsujˈad bimnoʔˈej silˈun ʃketˈim veχesχonijˈim hamafχitˈim ʔˈet zihˈum haʔavˈiʁ.
רובוטים תעשייתיים מבצעים פעולות הרכבה חוזרות ונשנות בדיוק מיקרוסקופי וללא כל עייפות.	ʁobotˈim taʔasijatijˈim mevatsʔˈim peʔulˈot haʁkavˈa χozʁˈot veniʃnˈot bedijˈuk mˈikʁoskˈopi ˈullo kˈol ʔajefˈut.
אימוני קרוספיט משלבים הרמת משקולות אולימפית, התעמלות קרקע ותרגילים אירוביים בעצימות גבוהה.	ʔimunˈej kʁospˈit meʃalvˈim haʁamˈat maʃkolˈot ʔolimpˈit, hitʔamlˈut kaʁkˈa vetaʁɡilˈim ʔejʁobijˈim baʔatsimˈut ɡvˈoha.
"ספינות משא ענקיות מנווטות באוקיינוסים באמצעות מערכות מכ""ם מתקדמות ותקשורת לוויינית מאובטחת."	sfinˈot masˈa ʔanakijˈot menuutˈot baʔokjanosˈim beʔemtsaʔˈut maʔaʁχˈot makˈam mitkadmˈot vetikʃˈoʁet lavjanˈit meʔuvtˈaχat.
המשפט האחרון העסיק מתמטיקאים דגולים במשך מאות שנים עד שהוכח.	hamiʃpˈat haʔaχaʁˈon heʔesˈik matemˈatikˈaʔim dɡulˈim bmˈeʃeχ meʔˈot ʃanˈim ʔˈad ʃehuχˈaχ.
סיבים אופטיים מעבירים נתונים דיגיטליים במהירות האור באמצעות החזרה פנימית גמורה של קרניים.	sˈivim ʔˈoptijim maʔaviʁˈim netunˈim diɡitˈalijim bimehiʁˈut haʔˈoʁ beʔemtsaʔˈut haχzaʁˈa pnimˈit ɡmuʁˈa ʃˈel kaʁnˈajim.
החיסון החדשני מעורר את המערכת החיסונית לייצר נוגדנים ספציפיים נגד נגיף השפעת.	haχisˈun haχadʃanˈi meʔoʁˈeʁ ʔˈet hamaʔaʁˈeχet haχisunˈit lejatsˈeʁ noɡdanˈim spetsˈifijim nˈeɡed neɡˈif haʃpˈaʔat.
הנגר האומן גילף עיטורים מסובכים בעץ אלון מלא בעזרת מפסלות פלדה חדות.	hanˈaɡaʁ haʔumˈan ɡilˈef ʔituʁˈim mesubaχˈim beʔˈets ʔalˈon malˈe beʔezʁˈat mifsalˈot pladˈa χadˈot.
כלבי נחייה עוברים אילוף ממושך וקפדני כדי לסייע לעיוורים להתנייד בבטחה במרחב הציבורי.	kalvˈej neχijˈa ʔovʁˈim ʔilˈuf memuʃˈaχ vekapdanˈi kedˈej lesajˈea laʔiuʁˈim lehitnajˈed bevitχˈa bameʁχˈav hatsibuʁˈi.
קרינת הרקע הקוסמית היא שריד עתיק מהמפץ הגדול שמהדהד ברחבי היקום.	kʁinˈat haʁˈeka hakosmˈit hˈi saʁˈid ʔatˈik mehamapˈats haɡadˈol ʃemhadhˈed beʁaχavˈej hajkˈum.
פילוסופיית הסטואה העתיקה ממליצה על שליטה רגשית וקבלת הגורל בשלוות נפש מוחלטת.	filosˈofjat hastoʔˈa haʔatikˈa mamlitsˈa ʔˈal ʃlitˈa ʁiɡʃˈit vekabalˈat haɡoʁˈal beʃalvˈat nˈefeʃ muχlˈetet.
וכשהתעוררנו מהתרדמת הארוכה, גילינו שהציוויליזציה האנושית נעלמה כליל מפני כדור הארץ.	uχeʃehitʔoʁˈaʁnu mehataʁdˈemet haʔaʁukˈa, ɡilˈinu ʃehatsˈijvilizatsja haʔenoʃˈit neʔelmˈa kalˈil mipnˈej kadˈuʁ haʔˈaʁets.
האופנוען הנועז ביצע פעלול אקרובטי מסוכן מעל התהום הפעורה בוואדי המדברי.	haʔofanoʔˈan hanoʔˈaz bitsˈea paʔalˈul ʔakʁovˈeti mesukˈan meʔˈal hatehˈom hapeʔuʁˈa bavadˈi hamidbaʁˈi.
